job_id,title,company,location,salary,job_type,category,description,posted_date,url,tags,source
remoteok_1130656,Senior Manager Platform Architecture,Temporal Technologies,United States,,remote,,"<div><h3><strong>About Us</strong></h3>
<div>Temporal is an open source programming model that can simplify code, make applications more reliable, and help developers focus on the important things like delivering features faster. We are on a mission to be the reliable foundation of every developer芒聙聶s toolbox, and are building the team that will make that happen.</div>
<div>&nbsp;</div>
<div>Our values guide us 芒聙聰they are present in how we show up, make decisions, and work together to make an impact. We're curious, driven, collaborative, genuine and humble.</div>
<div>&nbsp;</div>
<div>Temporal is growing and we are looking for those who share our values, challenge 'standard' thinking, and want to influence our future. If you have a passion for improving the developer experience, building world-class open-source software and communities, and want to be a part of our amazing team, we'd love to hear from you!</div></div><div><h3><strong>Summary</strong></h3>
<p>Join our team as <strong>Senior Manager, Platform Architecture</strong>, where you'll play a pivotal role in pioneering a new post-sales technical function at Temporal. We are building the Platform Architecture organization to own the path from purchase to safe, scalable production for our customers. In this position, you'll build and scale this function globally, defining how we run customers in production consistently and ensuring clear ownership across Sales, Support, Services, and Engineering. You'll raise the bar for what ""customer success"" means in a reliability-first company, empowering you to substantially impact how Temporal grows. This is a career-defining opportunity to shape a function that converts production success into long-term adoption and expansion.</p>
<h3><strong>What You'll Do</strong></h3>
<p><strong>Build and Lead the Platform Architecture Organization</strong></p>
<ul>
<li>Hire, coach, and develop a team of high-performing Platform Architects</li>
<li>Establish clear role boundaries, career paths, and operating standards</li>
<li>Set expect<br/><br/>Please mention the word **ALLURING** and tag RNzIuNDkuMjMxLjcx when applying to show you read the job post completely (#RNzIuNDkuMjMxLjcx). This is a beta feature to avoid spam applicants. Companies can search these words to find applicants that read this and see they're human.",2026-03-06T08:00:15+00:00,https://remoteOK.com/remote-jobs/remote-senior-manager-platform-architecture-temporal-technologies-1130656,"manager, technical, developer, software, lead, senior, digital nomad",remoteok
remoteok_1130655,Jr Social Media Manager,Keywords Studios,,,remote,,"<p>Please note that DMM will only contact you using email addresses that end in .com. We have been made aware that someone may be using aliases such as脗聽careers@digitalmediamanagement.us脗聽to contact individuals as part of an apparent scam. Those individuals are not affiliated with DMM, so we do not recommend interacting with that email alias, or any others that do not end in .com should you receive email correspondence that claims to be from us. If you have any questions or concerns, please do not hesitate to contact us at脗聽careers@digitalmediamanagement.com.</p><p></p><p>Digital Media Management (DMM), a Keywords Studios company, is a leading full-service digital agency, content studio and incubator specializing in social-first, 芒聙聹always-entertaining芒聙聺 marketing. DMM works with movie studios, television networks, streaming services and consumer brands to create groundbreaking social media campaigns via fan activations, innovative content creation, results-driven paid media planning, and strategic influencer-brand partnerships.</p><p></p><p>We are looking for a脗聽Jr. Social Media Manager脗聽to join our fun and growing TV &amp; streaming division. The junior manager will partner with their team to oversee social accounts and create innovative and engaging social media campaigns for a prominent broadcast TV client. Our ideal person has experience developing social strategies, building out content calendars, tailored copywriting, and engaging with audiences on social media channels.</p><p></p>Your Impact<ul><ul><li>Manage innovative and engaging social media campaigns</li><li>Ideate social media content buckets and creative</li><li>Post content to all social media channels</li><li>Facilitate community management on all social media channels</li><li>Build out content calendars and create a timeline for each campaign</li><li>Write creative copy and adjust voice/tone as needed</li><li>Administer reporting and analytics</li></ul></ul>
Your Experience<ul><ul><li>Experience working within the social media space, preferably within an agency environment</li><li>Experience working across social campaigns in entertainment or TV脗聽Experience posting on all platforms, as well as best practices for each (TikTok, Instagram, Facebook, Twitter/X, Reddit)</li><li>Ability to juggle multiple tasks and still meet deadlines</li><li>Strong copywriting skills</li><li>Excellent interpersonal and client communication/presentation skills</li><li>Ability to collaborate and work as part of a team</li></ul></ul><p></p>Your Availability<ul><ul><li>M-F: 9am-6pm PST with some flexibility to rarely work weekends for one or few hours</li></ul></ul>
Benefits<ul><li>Salary: $ 19,000-27,000 MXN Monthly (based on experience) Gross (before taxes)</li></ul><ul><li>Law Benefits.</li><li>2 days off.</li></ul><p>After 3 months of employment:</p><ul><li>Medical expenses insurance.</li><li>Saving funds.</li><li>Grocery tickets</li></ul><p></p><p>Company culture you ask?脗聽Our company culture is casual, fun, and empowering. There is a lot of room for growth in this role! That芒聙聶s right, no glass ceiling and room to learn.</p><p></p><p>Digital Media Management is an equal opportunity employer. We work together to create a space that fosters diversity and inclusion across race, color, gender, sexual orientation, gender identity/expression, disability, age, national origin, and veteran status. Our diversity strategy is simple: grow a team of creative, innovative, passionate people from varied backgrounds to produce best-in-class digital campaigns.</p><br/><br/>Please mention the word **EARNESTLY** and tag RNzIuNDkuMjMxLjcx when applying to show you read the job post completely (#RNzIuNDkuMjMxLjcx). This is a beta feature to avoid spam applicants. Companies can search these words to find applicants that read this and see they're human.",2026-03-06T08:00:04+00:00,https://remoteOK.com/remote-jobs/remote-jr-social-media-manager-keywords-studios-1130655,"manager, copywriting, growth, strategy, management, content, junior",remoteok
remoteok_1130654,Forward Deployed Engineer,"Runpod, Inc.","Remote, EMEA",,remote,,"Runpod is pioneering the future of AI and machine learning, offering cutting-edge cloud infrastructure for full-stack AI applications. Founded in 2022, we are a rapidly growing, well-funded company with a remote-first organization spread globally. Our mission is to create a foundational platform for developers to build and run custom AI systems that scale. Join us as we shape the future of AI.

As part of the Revenue Team, you'll work closely with customers, the sales team, the product team, the engineering team and the support team to ensure a seamless and delightful Runpod experience. Your role will focus on providing technical insights, resolving challenges, and building trust with customers. Our team is dedicated to delivering exceptional solutions and fostering collaboration across functions to make the platform as smooth and efficient as possible.

We are seeking a full-time, remote Forward Deployed Engineer to support the growth of our cloud platform. This role ensures customers experience seamless operations, addressing technical challenges, guiding onboarding, and collaborating with engineering and sales teams. Ideal candidates combine technical expertise with strong communication skills to enhance customer satisfaction and improve our platform.

You'll play a key role in solving technical challenges, shaping the customer experience, and driving product improvements. By building strong customer relationships and collaborating across teams, your contributions will directly enhance operational efficiency, customer satisfaction, and the success of Runpod.

<strong>Responsibilities:</strong>
<ul>
<li>Participate in sales meetings with customers, explain Runpod's specific technologies, provide architectural recommendations, and build proof-of-concept solutions to support onboarding for potential high-spending customers.</li>
<li>Troubleshoot and resolve critical or complex technical issues escalated by customers, including those related to configuration, performance, functionality, compatibility, or code errors in Runpod's products or services.</li>
<li>Utilize various tools and methods, such as code analysis, scripting for testing, log analysis and remote access, to identify root causes and deliver solutions or workarounds.</li>
<li>Communicate effectively with customers and internal teams, including engineering, sales, supply and product management teams, to ensure customer satisfaction and integrate valuable feedback.</li>
<li>Assist the support team in troubleshooting and resolving escalated technical ticket<br/><br/>Please mention the word **VIBRANTLY** and tag RNzIuNDkuMjMxLjcx when applying to show you read the job post completely (#RNzIuNDkuMjMxLjcx). This is a beta feature to avoid spam applicants. Companies can search these words to find applicants that read this and see they're human.",2026-03-06T07:00:06+00:00,https://remoteOK.com/remote-jobs/remote-forward-deployed-engineer-runpod-inc-1130654,"full-stack, technical, support, growth, code, cloud, management, operational, sales, engineer, engineering",remoteok
remoteok_1130651,Backend Developer,AutoDS,Remote,,remote,,"At <strong>AutoDS</strong>, recently acquired by Fiverr, we're revolutionizing the eCommerce world by providing innovative tools that empower online sellers globally. As a fast-growing company, we're looking for talented individuals who are passionate about technology, eCommerce, and making a real impact. If you're ready to join a dynamic team and thrive in a collaborative, fast-paced environment, we'd love to hear from you!

AutoDS is looking for a Backend Developer to join us!

At AutoDS, we're transforming the world of e-commerce by automating and simplifying the entire dropshipping process. Our platform empowers sellers by automating every step from product sourcing to order fulfillment.

We're focused on making e-commerce accessible and efficient, letting sellers spend less time managing orders and more time growing their businesses. Join AutoDS and be part of a team that's pioneering the future of e-commerce and innovation!

As a Backend Developer, you will play a pivotal role in driving the success of an exciting and groundbreaking e-commerce project. We're looking for a forward-thinking individual who thrives on solving complex challenges and is passionate about elevating their work to new heights.

<strong>Key Responsibilities</strong>
<ul>
<li>Contribute to the development and maintenance of the company's core product.</li>
<li>Enhance and extend Flask-based back-end services.</li>
<li>Design and implement integrations with internal and external APIs.</li>
<li>Advocate for and uphold best coding practices, delivering high-quality, scalable solutions.</li>
<li>Take part in maintaining production reliability through a shared on-call rotation.(Pager Duty)<br><br></li>
</ul>
<p><strong>Required Skills and Qualifications</strong></p>
<p>Hard Skills:</p>
<ul>
<li>Proven expertise in Python with 4+&nbsp; years of hands-on experience.</li>
<li>Proficiency in at least one additional object-oriented programming language.</li>
<li>Solid experience with SQL and database management.</li>
<li>Exper<br/><br/>Please mention the word **WHOA** and tag RNzIuNDkuMjMxLjcx when applying to show you read the job post completely (#RNzIuNDkuMjMxLjcx). This is a beta feature to avoid spam applicants. Companies can search these words to find applicants that read this and see they're human.",2026-03-06T02:00:12+00:00,https://remoteOK.com/remote-jobs/remote-backend-developer-autods-1130651,"developer, back-end, python, reliability, backend, ecommerce, e-commerce, digital nomad",remoteok
remoteok_1130650,Senior Data Analyst,Velir,,,remote,,"Velir is an established mid-sized agency with a top-tier portfolio of clients, ranging from the world's largest non-profits to Fortune 500 brands. As of 2023, Velir acquired Brooklyn Data Company, a premier data and analytics consultancy focused on leadership, process improvement, implementation, and advanced analytics.

At Velir, we believe people are our greatest asset. Our culture is built on a foundation of trust, collaboration, and continued improvement. We strive for excellence in everything we do, embracing challenges as opportunities for growth. Our success is driven by a shared passion for making a positive impact on our customers, our communities and each other. We are a remote first company that offers competitive pay and excellent benefits.

Overview
Senior Data Analysts play a pivotal role in helping our client organizations extract valuable insights from their data to make informed decisions and drive business improvements. As senior-level individual contributors, responsibilities span from data strategy and data modeling to data analysis and visualization. Our senior data analysts work closely with clients to understand their specific business requirements to tailor data analytics solutions to meet those needs. This may also include recommending and implementing the right data analytics tools, platforms, and technologies for clients' needs.

Because our clients are mostly US-based organizations, we look for professional proficiency in English, verbally and in writing.

Responsibilities
Data Analytics Expertise: This role is responsible for leveraging structured data to identify patterns and use reports and visualizations to summarize them for strategic decision-making. Yo<br/><br/>Please mention the word **NOBLE** and tag RNzIuNDkuMjMxLjcx when applying to show you read the job post completely (#RNzIuNDkuMjMxLjcx). This is a beta feature to avoid spam applicants. Companies can search these words to find applicants that read this and see they're human.",2026-03-05T23:00:28+00:00,https://remoteOK.com/remote-jobs/remote-senior-data-analyst-velir-1130650,"analyst, consultancy, strategy, senior, analytics",remoteok
remoteok_1130649,Staff Full Stack Engineer Contacts,Calendly,Remote - US,,remote,,"What芒聙聶s in it for you? Ready to make a serious impact? Millions of people already rely on Calendly, and we芒聙聶re still in the midst of exciting product growth 芒聙聰 it芒聙聶s a fantastic time to join us. Everything you芒聙聶ll work on here will accelerate your career to the next level. If you want to learn, grow, and do the best work of your life alongside the best people you芒聙聶ve ever worked with, then we hope you芒聙聶ll consider allowing Calendly to be a part of your professional journey. About the team & opportunity Calendly芒聙聶s Contacts team is building a system that turns contacts data into a rich, reliable system of record and unlocks new engagement workflows for our customers. We own the core contact data model, ingestion and enrichment pipelines, and the experiences that make it easy for users to act on their relationships across Calendly. We芒聙聶re taking a 0 - 1 product to its next phase of maturity, scale, and innovation. That means evolving our architecture, hardening our platform, and rapidly iterating on new AI-powered workflows that help solopreneurs and teams turn meetings into meaningful relationships. You芒聙聶ll report to an Engineering Director in Contacts and partner closely with other team leaders in driving our Contacts technical strategy. Why do we need you? We芒聙聶re looking for a Staff Engineer who can: Own critical parts of our Contacts stack end-to-end, from technical design to rollout and ongoing reliability. Guide the evolution from early-stage architecture to a scalable, well-instrumented, multi-tenant system that other teams can safely build on. Lead big, cross-cutting 芒聙聹0芒聙聯1 to 1芒聙聯100芒聙聺 initiatives in partnership with Product, Design, and other Engineering teams Raise the technical bar for the team through mentoring, eng leadership, and high-quality execution. A day in the life of an Staff Engineer at Calendly On a typical day, you will: Design and evolve services and data models for contacts and relationships that can support new workflows and downstream consumers. Drive decisions around our APIs, eventing, and data flows to keep Contacts a reliable system of record. Own complex, high-impact projects (e.g., new ingestion pipelines, enrichment features, or contact-centric workflows) from technical discovery through launch and iterative improvement. Break down ambiguous problem spaces into clear milestones and incremental, ship-as-you-go plans. Provide technical leadership across squads and workstreams, helping teams make good tradeoffs on performance, reliability, and complexity. Mentor senior and mid-level engineers, review design docs and PRs, and codify best practices in testing, observability, and production readiness. Collaborate with PMs and designers to translate customer problems into pragmatic solutions, especially for solopreneurs and small teams adopting CRM for the first time. Help define MVP scopes, instrumentation, and learning loops so we can move fast without compromising<br/><br/>Please mention the word **RAPID** and tag RNzIuNDkuMjMxLjcx when applying to show you read the job post completely (#RNzIuNDkuMjMxLjcx). This is a beta feature to avoid spam applicants. Companies can search these words to find applicants that read this and see they're human.",2026-03-05T23:00:14+00:00,https://remoteOK.com/remote-jobs/remote-staff-full-stack-engineer-contacts-calendly-1130649,"design, system, technical, support, growth, director, lead, senior, engineer, engineering, digital nomad",remoteok
remoteok_1130648,UX UI Designer,The Real Deal,Remote,,remote,,"<p><b>This&nbsp;is&nbsp;a&nbsp;freelance,&nbsp;hourly&nbsp;contract&nbsp;role&nbsp;working&nbsp;on&nbsp;a&nbsp;project&nbsp;basis</b></p><p><br></p><p><b>Job&nbsp;Details:</b></p><p><br></p><p>We&nbsp;are&nbsp;seeking&nbsp;a&nbsp;UX/UI&nbsp;designer&nbsp;who&nbsp;can&nbsp;improve&nbsp;usability,&nbsp;spacing,&nbsp;hierarchy&nbsp;and&nbsp;clarity</p><p>across&nbsp;product&nbsp;pages,&nbsp;dashboards&nbsp;and&nbsp;marketing&nbsp;surfaces.</p><p><br></p><p>This&nbsp;role&nbsp;is&nbsp;not&nbsp;purely&nbsp;visual.&nbsp;The&nbsp;ideal&nbsp;candidate&nbsp;understands&nbsp;product&nbsp;thinking,&nbsp;user&nbsp;flows&nbsp;and</p><p>conversion&nbsp;optimization,&nbsp;and&nbsp;can&nbsp;translate&nbsp;business&nbsp;goals&nbsp;into&nbsp;clean,&nbsp;intuitive&nbsp;interfaces.</p><p><br></p><p>You&nbsp;will&nbsp;collaborate&nbsp;closely&nbsp;with&nbsp;product&nbsp;and&nbsp;development&nbsp;to&nbsp;refine&nbsp;layouts,&nbsp;improve&nbsp;navigation</p><p>clarity&nbsp;and&nbsp;create&nbsp;a&nbsp;more&nbsp;modern,&nbsp;cohesive&nbsp;design&nbsp;system.</p><p><br></p><p><b>Responsibilities</b></p><p>Audit&nbsp;existing&nbsp;TRD&nbsp;Data&nbsp;and&nbsp;website&nbsp;pages&nbsp;for&nbsp;usability&nbsp;and&nbsp;design&nbsp;inconsistencies</p><p>Improve&nbsp;spacing,&nbsp;typography&nbsp;hierarchy&nbsp;and&nbsp;visual&nbsp;clarity</p><p>Redesign&nbsp;key&nbsp;product&nbsp;landing&nbsp;pages&nbsp;and&nbsp;dashboard&nbsp;entry&nbsp;points</p><p>Help&nbsp;simplify&nbsp;navigation&nbsp;and&nbsp;highlight&nbsp;product&nbsp;features&nbsp;more&nbsp;effectively</p><p>Create&nbsp;Figma&nbsp;files&nbsp;that&nbsp;are&nbsp;organized&nbsp;and&nbsp;developer&nbsp;ready</p><p>Establish&nbsp;basic&nbsp;design&nbsp;system&nbsp;guidelines&nbsp;including&nbsp;spacing&nbsp;rules,&nbsp;typography&nbsp;scale&nbsp;and&nbsp;component&nbsp;patterns</p><p>Iterate&nbsp;based&nbsp;on&nbsp;feedback&nbsp;from&nbsp;product&nbsp;leadership</p><p>Suggest&nbsp;UX&nbsp;improvements&nbsp;based&nbsp;on&nbsp;user&nbsp;behavior&nbsp;and&nbsp;engagement&nbsp;patterns</p><p>Provide&nbsp;guidance&nbsp;on&nbsp;improving&nbsp;subscription&nbsp;conversion&nbsp;through&nbsp;layout&nbsp;and&nbsp;messaging</p><p>clarity</p><p><br></p><p><b>Qualifications</b></p><p>4+&nbsp;years&nbsp;experience&nbsp;in&nbsp;UX/UI&nbsp;design</p><p>Strong&nbsp;portfolio&nbsp;demonstrating&nbsp;clean,&nbsp;modern&nbsp;SaaS&nbsp;or&nbsp;data&nbsp;product&nbsp;design</p><p>Experience&nbsp;designing&nbsp;dashboards&nbsp;or&nbsp;data-heavy&nbsp;interfaces</p><p>Strong&nbsp;understanding&nbsp;of&nbsp;layout&nbsp;systems,&nbsp;spacing&nbsp;principles&nbsp;and&nbsp;typography</p><p>Highly&nbsp;proficient&nbsp;in&nbsp;Figma</p><p>Ability&nbsp;to&nbsp;work&nbsp;within&nbsp;an&nbsp;existing&nbsp;brand&nbsp;and&nbsp;improve&nbsp;it&nbsp;without&nbsp;reinventing&nbsp;everything</p><p>Comfortable&nbsp;collaborating&nbsp;with&nbsp;product&nbsp;and&nbsp;engineering&nbsp;teams</p><p><br></p><p><b>Nice&nbsp;to&nbsp;have:</b></p><p>Experience&nbsp;with&nbsp;media,&nbsp;publishing&nbsp;or&nbsp;B2B&nbsp;products</p><p>Familiarity&nbsp;with&nbsp;analytics-driven&nbsp;design&nbsp;decisions</p>\n<p></p><p><br></p><p></p>\n<p><b>Who We Are: </b></p><p>&nbsp;</p><p>The Real Deal is the largest real-estate news outlet in the US, reaching millions of professionals daily through our media channels. We have received 60+ awards for editorial excellence over the past six years, including the General Excellence award from the Society of Business Writers and Editors. </p><p>&nbsp;</p><p>Quantcast rates us among the 300-most visited sites in the US and the website with the wealthiest audience and one of the most educated.</p><p>As a publication, The Real Deal is to real estate what Variety is to entertainment or what Politico is to Beltway politics 芒聙聯 a plugged-in news outlet that is read by the entire industry. </p><p>&nbsp;</p><p>We are an equal opportunity employer and value diversity at our company. We do not discriminate based on race, religion, color, national origin, gender, sexual orientation, age, marital status, veteran status, or disability status. We partner with our employees to support diversity and inclusion in the workplace and through higher education programs supporting rising journalists.&nbsp;</p><br/><br/>Please mention the word **EXALTATION** and tag RNzIuNDkuMjMxLjcx when applying to show you read the job post completely (#RNzIuNDkuMjMxLjcx). This is a beta feature to avoid spam applicants. Companies can search these words to find applicants that read this and see they're human.",2026-03-05T22:14:41+00:00,https://remoteOK.com/remote-jobs/remote-ux-ui-designer-the-real-deal-1130648,"ui, ux, designer, support, education",remoteok
