job_id,title,company,location,salary,job_type,category,description,posted_date,url,tags,source
remoteok_1130596,Engineering Manager,EnergyHub,,,remote,,"<p><strong>About EnergyHub</strong></p>
<p>EnergyHub empowers utilities and their customers to create a clean, distributed energy future. We help consumers turn their smart thermostats, EVs, batteries, and other products into virtual power plants that keep the grid stable and enable higher penetration of solar and wind power.</p>
<p>We are looking for an Engineering Manager who thrives in a fast-paced, dynamic environment, is comfortable navigating ambiguity while moving projects forward, and is motivated to build software and processes that foster greater team efficiency and scalability across the organization. This person will focus on people management, strategic alignment and software development projects that have a meaningful impact on EnergyHub's product and people.</p>
<p>As Engineering Manager for the Program team, you will own a core part of our platform: how customer programs are configured, launched, tested, and maintained across a growing set of product offerings. You will help evolve a critical system that sits at the intersection of product, operations, and platform engineering. This role is ideal for someone who enjoys bringing clarity to complex domains, improving internal tooling, and building systems that scale as the business grows. As we scale, you will champion technical excellence while balancing new feature delivery, technical debt reduction, and modernizing the user experience to empower client-facing teams.</p>
<p><strong>Main Responsibilities: What you'll do</strong></p>
<ul>
<li>Build, manage, and mentor a team of engineers working on shared platform capabilities.</li>
<li>Partner with cross-functional teams, including Engineering and Product, to define the team's mission, vision, and roadmap</li>
<li>Provide strategic oversight, architectural direction and execution for new team initiatives, such as building new UI workflows, code refactoring and transition to micro-services environment</li>
<li>Act as a technical partner to Product, QA, Analytics, and client-facing teams.</li>
<li>Translate cross-functional needs into clear technical plans and priorities.</li>
<li>Communicate tradeoffs and progress clearly to both technical and non-technical stakeholders.</li>
<li>Ensure the team delivers quality, scalable, well-tested, code on time and in scope.</li>
<li>Continuously raise the bar for your team through organizational evolution, agile process improvement efforts and leveling your team's technical prowess</li>
<li>Thrive o<br/><br/>Please mention the word **PLEASING** and tag RNzIuNDkuMjMxLjcx when applying to show you read the job post completely (#RNzIuNDkuMjMxLjcx). This is a beta feature to avoid spam applicants. Companies can search these words to find applicants that read this and see they're human.",2026-03-03T00:01:09+00:00,https://remoteOK.com/remote-jobs/remote-engineering-manager-energyhub-1130596,"manager, system, technical, software, ui, code, engineering",remoteok
remoteok_1130595,Senior Human Resources Manager,Flatiron Energy,"Boulder/Denver, New York City, or Boston",,remote,,"<p><strong>About Flatiron Energy </strong></p>
<p>Flatiron Energy, a Hull Street Energy portfolio company, is developing and building grid scale standalone energy storage assets that integrate renewable energy onto the grid, replace fossil fuel plants, and increase grid reliability. Founded by a team of experienced energy storage experts, Flatiron has a demonstrated track record of developing critical infrastructure needed to achieve our reliability and energy climate goals. &nbsp;The leadership team has deep experience in developing, constructing and operating energy storage assets in wholesale markets.&nbsp;</p>
<p>Flatiron Energy is a growing company with a dynamic, fast-paced, challenging, creative, fun, start-up culture. The right candidate will be excited to help build the company from the ground up, recognizing the challenges and opportunities for growth inherent in such a role.&nbsp; The Flatiron team is passionate about fighting climate change while ensuring their projects have an equitable impact on surrounding communities. Flatiron is only looking for candidates who resonate with our mission.</p>
<p><strong>Title:</strong> Senior HR Manager &nbsp;&nbsp;&nbsp;&nbsp;</p>
<p><strong>Reports To:</strong> CEO</p>
<p><strong>Location:</strong> Boulder/Denver, New York City, or Boston preferred, remote also considered</p>
<p><strong>Description:</strong> The Senior HR Manager will play a key role in building out Flatiron芒聙聶s human resources function and supporting our employees. enabling the growth of our employees in their careers. &nbsp;Reporting directly to the CEO, you芒聙聶ll own employee relations matters end-to-end, drive consistency in performance management, hiring workflows, documentation, benefit management, and employee engagement. In this role you will advise leadership on best practices, lead performance management and processes, develop career progression plans, and create new tools and protocols to enhance people operations and effectiveness.</p>
<p><strong>Key Responsibilities:</strong></p>
<ul>
<li>Own employee relations matters end-to-end, from candidate hiring to new hire training to employee performance management</li>
<li>Organize and run annual and quarterly performance review cycles (communications, manager enablement, and completion tracking)</li>
<li>Partner with leadership<br/><br/>Please mention the word **COMPREHENSIVE** and tag RNzIuNDkuMjMxLjcx when applying to show you read the job post completely (#RNzIuNDkuMjMxLjcx). This is a beta feature to avoid spam applicants. Companies can search these words to find applicants that read this and see they're human.",2026-03-03T00:00:53+00:00,https://remoteOK.com/remote-jobs/remote-senior-human-resources-manager-flatiron-energy-1130595,"manager, hr, training, growth, management, lead, senior, operations, reliability",remoteok
remoteok_1130594,Inbound Sales Agent,Storage360,,$18+,remote,,"Welcome and thank you for your interest in joining our team!

We芒聙聶re excited that you芒聙聶re considering a career with us. At Storage360, we芒聙聶re always looking for individuals who bring passion, integrity, and a commitment to excellence in everything they do. This application is your first step toward becoming part of a team that values collaboration, growth, and meaningful impact.

Working for Storage360 definitely has it perks:

芒聙垄 **Comprehensive Benefits** 芒聙聯 including medical, dental, vision, life, disability, and 401(k) retirement plans.
芒聙垄 **Work-Life Balance Support** 芒聙聯 paid time off, holidays, sick leave, parental leave, and other forms of protected leave across our companies.
芒聙垄 **Wellness & Lifestyle Perks** 芒聙聯 employer-funded Lifestyle Spending Account, Employee Assistance Program, and access to voluntary benefits such as pet insurance, accident, and critical illness coverage.
芒聙垄 **Growth & Opportunity** 芒聙聯 a culture of training, development, and internal promotion, with clear pathways for career advancement!

We look forward to learning more about you!

&nbsp;

&nbsp;

**REMOTE INBOUND SALES AGENT**

Do you have high energy and customer service/sales experience? Are you interested in being part of a team that nurtures your professional success? If so, **Storage360** is looking to hire a **Remote** **Inbound Sales Agent **to join our Call Center team and it could be you!

The hourly rate for this position is **$18.00 with a competitive monthly bonu<br/><br/>Please mention the word **ENTHUSIASTICALLY** and tag RNzIuNDkuMjMxLjcx when applying to show you read the job post completely (#RNzIuNDkuMjMxLjcx). This is a beta feature to avoid spam applicants. Companies can search these words to find applicants that read this and see they're human.",2026-03-03T00:00:42+00:00,https://remoteOK.com/remote-jobs/remote-inbound-sales-agent-storage360-1130594,"sales, non tech",remoteok
remoteok_1130593,Director Sales,Parachute Health,U. S.,,remote,,"Parachute Health is transforming post-acute care through the leading digital ordering platform for medical equipment and supplies. We replace the outdated, error-prone paper and fax process, which negatively impacts over 30 million patients annually, with a system that's 10 times faster. Our platform connects a vast network of Home Medical Equipment (HME) providers, clinicians, and payors across all 50 states, ensuring millions of patients get the life-saving products they need quickly and efficiently.脗聽

Join our team and make a difference in patient care.

About the Role
The Sr. Director, Sales of Home Medical Equipment (HME) Sales is responsible for leading and scaling the company芒聙聶s HME-focused SaaS revenue engine. This role owns sales strategy, execution, and team leadership for a sales organization, driving lead generation, new customer acquisition, and retention across HME providers ranging from small business, mid-market to enterprise.
This leader partners closely with Marketing, Customer Success, Product, and Strategic Partnerships to deliver predictable growth, shorten sales cycles, and position the company as a trusted technology partner within the HME ecosystem.

Key Responsibilities
芒聙垄 Own and execute the HME sales strategy aligned to company revenue and growth objectives
芒聙垄 Lead, coach, and develop a sales professionals (new business, account management, or hybrid, as applicable)
芒聙垄 Establish clear performance expectations, KPIs, and accountability across the team
芒聙垄 Drive a high-performance, customer-centric sales culture<br/><br/>Please mention the word **PRIVILEGE** and tag RNzIuNDkuMjMxLjcx when applying to show you read the job post completely (#RNzIuNDkuMjMxLjcx). This is a beta feature to avoid spam applicants. Companies can search these words to find applicants that read this and see they're human.",2026-03-03T00:00:31+00:00,https://remoteOK.com/remote-jobs/remote-director-sales-parachute-health-1130593,"director, saas, system, growth, leader, strategy, lead, sales, medical, health",remoteok
remoteok_1130592,Account Executive Alcohol,Swiftly ,United States (Remote),,remote,,"<p><b>Swiftly </b><span style=""font-size: 12pt;"">is a retail digital technology startup founded in 2018 and headquartered in the Bay Area. We empower regional and independent grocers to compete in a digital-first world by providing best-in-class app, web, loyalty, and e-commerce solutions芒聙聰without SaaS fees. Instead, Swiftly drives revenue through its retail media network, sharing profits with retailer partners.</span></p><p><span style=""font-size: 12pt;"">With 70+ retailer banners and Series C funding, Swiftly is the first in the industry to seamlessly connect digital and in-store shopping. Our AI-powered platform helps retailers build strong digital relationships, while our solutions芒聙聰Audience Optimizer芒聞垄, Alcohol Cashback, and Offsite Campaigns芒聙聰drive shopper engagement and brand success.</span></p><p><br></p><p><span style=""font-size: 12pt;"">Our mission: </span><b><span style=""font-size: 12pt;"">Enable brick-and-mortar retailers to thrive in a digital world.</span></b></p><p><br></p><p><b style=""font-size: 11pt;"">Position Summary:</b><span style=""font-size: 11pt;"">&nbsp;</span></p><p><span style=""font-size: 11pt;"">Swiftly is a growing organization and is looking for&nbsp;a seasoned&nbsp;Account&nbsp;Executive&nbsp;to add to our team that will build and foster ongoing relationships with&nbsp;Adult Beverage&nbsp;brands in the retail space. In this role you will balance business development with warm leads to grow our client portfolio and expand our Retail Media Network.&nbsp;</span></p>\n<p></p><p><br></p><b>Responsibilities Include: </b><ul><li>Develop and&nbsp;maintain&nbsp;long term strategic relationships with key customers,&nbsp;establishing&nbsp;a sustainable platform for continued development of the Top芒聙聬to芒聙聬Top relationship between Swiftly and our clients&nbsp;</li><li>Achieve quarterly revenue goals&nbsp;</li><li>Lead the preparation of strategic plans, encompassing sales&nbsp;and marketing activities, using category, consumer, shopper, and market information to maximize opportunities and&nbsp;revenue potential&nbsp;</li><li>Identify&nbsp;key decision芒聙聬makers and develop action plans to deepen&nbsp;client relationships&nbsp;</li><li>Develop an intimate understanding of&nbsp;Swiftly芒聙聶s&nbsp;business&nbsp;and our clients&nbsp;using a variety of sources&nbsp;&nbsp;</li><li>Lead and execute annual&nbsp;marketing planning and joint business planning&nbsp;</li><li>Collaborate with&nbsp;internal and external partners to execute strategic, integrated media&nbsp;programs&nbsp;</li><li>Manage and ensure forecast accuracy for current and new products and execute new product launches&nbsp;</li><li>Monitor performance of&nbsp;media&nbsp;campaigns and apply insights to drive incremental revenue&nbsp;&nbsp;</li><li>Other related duties as assigned</li></ul><p><br></p><b>Required Qualifications: </b><ul><li>5-7+ years of experience selling in the Adult Beverage space&nbsp;</li><li>A proven history of developing relationships from both warm leads and expanding your own network&nbsp;</li><li>Strong verbal and written communication skills, including presentation experience&nbsp;</li><li>Extensive prior exposure to supporting and working with executive senior management&nbsp;</li><li>Strong listening, questioning and negotiation skills 芒聙聬 outstanding communication and interpersonal skills&nbsp;</li><li>Disciplined time management and ability to work under pressure in a cross functional environment&nbsp;</li><li>Excellent proposal writing and presenting, project management and analytical skills&nbsp;</li><li>Advanced computer software proficiency (word, excel, outlook, PowerPoint and Salesforce)&nbsp;</li><li>High level of expertise in analyzing information and making information-based recommendation&nbsp;</li><li>This position is not eligible for visa sponsorship. Applicants must芒聙炉be authorized to芒聙炉work in the U.S. without the need for current or future sponsorship芒聙炉&nbsp;</li></ul><p><br></p><b>Preferred Qualifications: </b><ul><li>BA/BS with strong academic record&nbsp;&nbsp;</li><li>Existing network of contacts in the Alcohol vertical (Brand-Direct and Agency)&nbsp;</li></ul><p><br></p><p></p>\n<div>$100,000 - $105,000 a year</div><small><div>The salary range is based on the candidates experience as it relates to the role.</div></small>\n<p>#LI-Remote</p><p><span style=""font-size: 16px;"">Note: </span>This position is not eligible for visa sponsorship. Applicants must be authorized to work in the U.S. without the need for current or future sponsorship.</p><p><br></p><p><b>Working For Swiftly</b></p><p>We are working on a set of problems that require the best in the industry to get right. Our employees are the pillars of the future of the company and they are treated and compensated as such. We're a growing team of experienced industry professionals building an organization that can solve tough problems and values a collaborative environment.&nbsp;</p><p><br></p><p><b>Every Swiftly employee:&nbsp;</b></p><p>-Has demonstrated the ability to work collaboratively in an ambiguous, fast-paced environment&nbsp;</p><p>-Takes ownership of their domain from the ground up, from inception through deployment to customers&nbsp;</p><p>-Leaves their ego at the door and ensures the best idea leaves the room&nbsp;</p><p>-Is always experimenting with new technologies and learning new skillsets&nbsp;</p><p><br></p><p>If you've ever wanted to work on a project that blends a gorgeous consumer experience, sophisticated logistics, and scale that rivals the largest technology players,&nbsp;Swiftly&nbsp;is the place for you.&nbsp;</p><p><br></p><p><b>Equal Opportunity Employer</b>&nbsp;</p><p>Swiftly is an&nbsp;Equal Employment Opportunity and Affirmative Action Employer.&nbsp; Qualified applicants will receive consideration for employment without regard to race, color, religion, sex, sexual orientation, gender perception or identity, national origin, age, marital status, protected veteran status, or disability status.芒聙炉&nbsp;</p><p>Swiftly will make reasonable accommodations in compliance with the Americans with Disabilities Act of 1990. Reasonable&nbsp;accommodations are&nbsp;available for qualified individuals with disabilities throughout the subsequent application process.&nbsp;</p><br/><br/>Please mention the word **FRESH** and tag RNzIuNDkuMjMxLjcx when applying to show you read the job post completely (#RNzIuNDkuMjMxLjcx). This is a beta feature to avoid spam applicants. Companies can search these words to find applicants that read this and see they're human.",2026-03-03T00:00:21+00:00,https://remoteOK.com/remote-jobs/remote-account-executive-alcohol-swiftly-1130592,"saas, software, adult, c, management, senior, marketing, executive, e-commerce",remoteok
remoteok_1130591,Associate Product Manager,InvestorFlow,Remote - Santo Domingo,,remote,,"<p><b>InvestorFlow</b> is the only company of its kind to deliver industry specialized CRM, built on Salesforce, and digital portals to help alternative asset firms find opportunities, create and manage relationships, and turn relationship insights into action with increased productivity and transparency.</p><p><br></p><p>Are you passionate about solving customer problems, learning the craft of product management, and contributing to impactful results? At InvestorFlow, we are creating end-to-end, engaging experiences that tailor Investor, Fund-Centric Relationship Management and Digital Engagement for Capital Markets. The company is strategically positioned to leverage #AgenticAI as a differentiator to enable Raising Capital, Deploying Capital, and Servicing Investor Relationships across Private Equity, Private Capital, and Real Estate. We are seeking a motivated and driven Associate Product Manager to join our team. This role supports our product team in aligning cross-functional priorities and delivering exceptional value to our customers. Working closely with senior product managers, you will develop your skills across five core pillars of product management while contributing tactically to bring our product strategy to life.</p>\n<p></p><p><br></p><b>You Will: </b><ul><li>&nbsp;Support market research efforts to understand customer needs and pain points, contributing to product value propositions that align with business goals and revenue targets (ARR, NRR).</li><li>Assist senior product managers in identifying Minimum-Viable Products (MVPs), value-based target outcomes, and key 芒聙聹Jobs-To-Be-Done芒聙聺 across assigned product areas.</li><li>Help gather and analyze customer surveys, RFPs, and product analytics to understand customer motivations and behaviors, supporting data-driven product requirements.</li><li>Partner with UX/UI designers to deliver intuitive and delightful user experiences.</li><li>Develop, document, and evangelize product initiatives and features as well as sequence delivery plans to ensure scalable growth or create operational efficiencies for customers and in line with company business goals. (Product Board)</li><li>Drive product planning and create 芒聙聹Commit-to-Plan芒聙聺 product milestones across strategies, initiatives, and features on a release, quarterly, and annual basis.</li><li>Own the product backlog, prioritizing features and initiatives based on impact, outcomes, feasibility, customer needs, revenue targets, and innovation.</li><li>Collaborate with engineering teams to ensure timely delivery of high-quality product releases, always shepherding and evangelizing key priorities.</li><li>Monitor product development progress, proactively removing roadblocks and ensuring smooth execution to ensure the product is introduced to the market as intended.</li><li>Demonstrate accountability from committed product plans through product delivery, including capabilities available to sell (demonstrate), implement (to new and existing SAAS environments), recognize revenue, and drive customer adoption and stickiness.</li><li>Serve as a key contributor across cross-functional teams, including design, engineering, marketing, sales, support, and implementation teams.</li><li>Help prepare and communicate product updates and priorities for stakeholder reviews across weekly, monthly, and quarterly cadences.</li><li>Contribute to 芒聙聹Tell-A-Story芒聙聺 presentations on product roadmaps, design options, and delivery plans for internal and external audiences.</li><li>Help facilitate feedback loops with customers and internal teams to continuously improve the product.</li><li>Assist in maintaining the product roadmap by gathering inputs, tracking progress, and ensuring alignment with company objectives.</li><li>Use data-driven insights to support product decisions, learning to balance short-term wins with long-term investments.</li><li>Support the tracking and reporting of Service Level Agreements (SLAs) to ensure reliability and performance commitments.</li><li>Help ensure product considerations are documented across initiatives芒聙聰including supportability, risk, frictionless experiences, impact, and feasibility芒聙聰and contribute inputs for sales cycles and customer implementations.</li></ul><p><br></p><b>You Have:</b><ul><li>Bachelor芒聙聶s degree in Business, Engineering, Computer Science, or related field, or equivalent practical experience.</li><li>1芒聙聯3 years of product management, business analysis, or related experience, preferably in FinTech, enterprise SaaS, or B2B environments with exposure to product strategy, roadmaps, and delivery processes.</li><li>Foundational customer research and market analysis skills with familiarity in data-driven product decisions, product backlogs, and agile development processes.</li><li>Demonstrated ability to collaborate cross-functionally across teams and departments.</li><li>Developing business acumen with interest in product analytics, SaaS metrics (ARR, NRR, churn), and revenue fundamentals.</li><li>Strong communication skills with ability to participate in customer interactions and help translate needs into product requirements.</li><li>&nbsp;Interest in Financial Services, particularly capital markets, investment management, or private equity workflows.</li><li>Exposure to building or supporting products for multiple user personas, SaaS business models, CRM systems, or relationship management platforms.</li><li>Curiosity about emerging FinTech technologies and the tools and technology used to expedite and streamline product delivery.</li></ul><p><br></p><p></p>\n<p><b>InvestorFlow</b> is an investor and deal engagement platform that prioritizes intelligent digital experiences, productivity, and engagement. Our cloud-native platform integrates deal flow management, fundraising, reporting, and investor services. We are proud to serve over 175 clients, including 25 of the top 50 alternative asset managers, managing more than $6 trillion in assets, 750 funds, and 90,000 LPs. Headquartered in San Francisco, California, we are committed to driving innovation and inclusivity in the financial industry. To learn more about our company, please visit <a class=""postings-link"" href=""http://www.investorflow.com/"">www.investorflow.com</a>.&nbsp;</p><br/><br/>Please mention the word **WILLING** and tag RNzIuNDkuMjMxLjcx when applying to show you read the job post completely (#RNzIuNDkuMjMxLjcx). This is a beta feature to avoid spam applicants. Companies can search these words to find applicants that read this and see they're human.",2026-03-03T00:00:13+00:00,https://remoteOK.com/remote-jobs/remote-associate-product-manager-investorflow-1130591,"manager, design, saas, support, growth, financial, investment, investor, fintech, strategy, management, senior, operational, analytics, sales, reliability, engineering, digital nomad",remoteok
