job_id,title,company,location,salary,job_type,category,description,posted_date,url,tags,source
remoteok_1130691,Executive Brand Operations,Gate,APAC-C1,,remote,,"<p><b>Our Vision&nbsp;</b></p><p>As one of the world芒聙聶s top 10 (and rising冒聼職聙) digital asset exchanges, we provide a best- in-class experience in trading, security, and blockchain product innovation.&nbsp;</p><p>We aim to democratize access to the markets for all, making it possible for the most recent and promising cryptocurrency projects to be listed and traded safely and securely. Are you excited to join a decentralizing force in the world?&nbsp;</p>\n<p></p><p><br></p><b>Job description</b><ul><li>- Trend Identification &amp; Strategy: Monitor Web3 and global macro-finance trends in real-time. Utilize your research background to independently develop high-value content themes, ensuring the executive芒聙聶s voice remains at the industry芒聙聶s forefront.</li><li>- Professional Voice &amp; Outputs: Lead the executive芒聙聶s presence on X (Twitter) and other platforms. Draft and refine sophisticated content in both English and Chinese, including in-depth viewpoints, media interview scripts, Q&amp;A frameworks, and talking points for global summits.</li><li>- Account Operations: Manage the daily presence and professional engagement of social media accounts. Build long-term influence within global Web3 circles through the consistent output of high-signal content.</li><li>- IP Strategic Support: Assist with other tasks related to the exec</li></ul><p><br></p><b>Requirements</b><ul><li>- Education: Degree from a reputable university in Finance, Economics, or a related field.</li><li>- Web3 Expertise: Deeply rooted in the Web3 ecosystem. Strong grasp of DeFi, protocols, and crypto-economics, with the professional caliber to conduct independent industry research.</li><li>- Linguistic Mastery: Flawless proficiency in English writing (Native-level) and professional Chinese narrative skills. Ability to produce credible, precise content with zero ""translation feel.""</li><li>- Execution Excellence: Highly self-motivated with the ability to manage the entire workflow芒聙聰from research to final bilingual delivery芒聙聰independently in a fast-paced environment.</li></ul><p><br></p><p></p>\n<p><b>We are&nbsp;</b></p><p>A values-based culture that trusts your knowledge, vision, and autonomy, we focus on taking the best products and campaigns to wow our customers and bring the freedom of decentralization to every part of the world.&nbsp;</p><p>Integrity, insight, innovation, purpose and cooperation are inscribed within our culture. At Gate, we are committed to GateStyles and we are looking for candidates who also exhibit the same values.&nbsp;</p><p><br></p><p>Gate, founded in 2013, is one of the pioneering cryptocurrency exchanges and offers services worldwide related to the trading of multiple leading digital assets. With millions of registered users, it is considered one of the safest and most reliable global cryptocurrency platforms, consistently ranked among the top 10 cryptocurrency exchanges based on liquidity and trading volume (CoinGecko). Additionally, Gate has been verified by Blockchain Transparency.&nbsp;</p><br/><br/>Please mention the word **ADVOCATES** and tag RNzIuNDkuMjMxLjcx when applying to show you read the job post completely (#RNzIuNDkuMjMxLjcx). This is a beta feature to avoid spam applicants. Companies can search these words to find applicants that read this and see they're human.",2026-03-09T12:00:02+00:00,https://remoteOK.com/remote-jobs/remote-executive-brand-operations-gate-1130691,"web3, cryptocurrency, voice, lead, content, operations, executive",remoteok
remoteok_1130690,Senior Python Backend Engineer Mission Critical,Amstar Curacao,,$30000 - $50000,remote,,"<blockquote><div dir=""ltr""><div><h2>About Us</h2><p>We are a 26-year established Destination Management Company (DMC) operating under the脗聽<strong>Amstar DMC brand</strong>, the official destination services and tour operator brand of脗聽<strong>Hyatt Corporation</strong>.</p><p>We support major North American travel brands including:</p><ul><li><p>Apple Vacations</p></li><li><p>American Express Vacations</p></li><li><p>CheapCaribbean</p></li><li><p>Expedia</p></li><li><p>Hyatt</p></li><li><p>And more than 12 additional travel brands</p></li></ul><p>Our platform supports daily operational workflows for:</p><ul><li><p>Transfer bookings (airport 芒聠聰 hotel)</p></li><li><p>Tours and excursions</p></li><li><p>Vacation-related services</p></li><li><p>Automated dispatch and resource allocation</p></li><li><p>Supplier coordination</p></li><li><p>Operational handling</p></li><li><p>Financials (invoicing, payments, credit card payments etc)</p></li></ul><p>The system automatically assigns drivers, vehicles, and partner companies required for service delivery.</p><p>This is a real-time operational system used daily in production.</p><hr /><h1>Current System (Legacy Overview)</h1><p>We operate a 24-year-old Perl-based monolithic application.</p><h3>Codebase</h3><ul><li><p>~250,000 lines total</p><ul><li><p>~100K core Perl code</p></li><li><p>63K template toolkit</p></li><li><p>43K configuration system</p></li><li><p>17K Perl scripts</p></li><li><p>25K web framework</p></li></ul></li><li><p>Single monolithic architecture</p></li><li><p>Single MySQL database</p></li><li><p>178 tables</p></li><li><p>10 background jobs</p></li><li><p>ORM used since inception (limited direct SQL usage)</p></li></ul><h3>Integrations</h3><ul><li><p>Google Drive</p></li><li><p>Gmail</p></li><li><p>FlightStats</p></li><li><p>WhatsApp</p></li><li><p>Stripe (payments)</p></li></ul><p>Additional workflows:</p><ul><li><p>Email parsers reading Excel attachments</p></li><li><p>CSV generation &amp; ingestion via Google Drive</p></li><li><p>Google Forms integrations</p></li><li><p>Blocking page flows in current UI</p></li></ul><hr /><h1>Infrastructure</h1><ul><li><p>Hosted on DigitalOcean VPS</p></li><li><p>Ubuntu 22.10 (scheduled for upgrade)</p></li><li><p>Dev / Stage / Production environments</p></li><li><p>Python services are Dockerized</p></li><li><p>Perl system is not containerized</p></li><li><p>Partial CI/CD automation (Python only)</p></li><li><p>Infrastructure managed by current Senior Developer</p></li><li><p>Automated database backups + monthly restore testing</p></li><li><p>No replication currently</p></li><li><p>Downtime tolerance: up to 8 hours (business continuity procedures exist)</p></li></ul><hr /><h1>Migration Status &amp; Goal</h1><p>We are executing a phased migration from Perl to Python.</p><ul><li><p>~20% already migrated</p></li><li><p>Target: &gt;80% migrated within 12 months</p></li><li><p>End goal: full replacement of legacy Perl system</p></li></ul><p>Current modernization streams:</p><ol><li><p>Migrate email &amp; WhatsApp handling to AI-driven solution</p></li><li><p>Rebuild core order management functionality in Python (FastAPI)</p></li><li><p>Develop new UI for drivers and hostesses</p></li><li><p>Gradually decouple monolith into modular services</p></li></ol><p>This is a controlled, staged production migration.</p><hr /><h1>Team Structure</h1><ul><li><p>1 senior developer (20 years on system)</p></li><li><p>1 QA</p></li><li><p>No dedicated DevOps</p></li><li><p>Requirements defined by business + management + senior dev</p></li><li><p>Production incidents handled by senior dev</p></li><li><p>Very stable production system (minimal incidents in last 12 months)</p></li></ul><p>This role will significantly strengthen and eventually take ownership of the modernization effort.</p><hr /><h1>Required Technical Skills (Must Have)</h1><ul><li><p>Strong Python experience</p></li><li><p>Proven production experience with FastAPI</p></li><li><p>Strong MySQL knowledge (schema, indexing, query optimization)</p></li><li><p>Comfortable in Linux (Ubuntu) CLI</p></li><li><p>Experience with pytest</p></li><li><p>GitHub + GitHub Actions CI/CD</p></li><li><p>Experience deploying behind Nginx or Apache</p></li><li><p>Docker experience</p></li><li><p>Professional use of VS Code or similar</p></li><li><p>Understanding of API design and system decoupling</p></li></ul><hr /><h1>Secondary (Nice to Have)</h1><ul><li><p>Ability to read Perl code</p></li><li><p>Experience modernizing monolithic systems</p></li><li><p>Experience with Google APIs脗聽</p></li><li><p>Experience with Stripe or payment systems</p></li><li><p>Basic React experience (for internal admin tools)</p></li></ul><p>React is not a primary frontend role requirement.</p><hr /><h1>Work Environment</h1><ul><li><p>Fully remote</p></li><li><p>Daily scrum (max 30 minutes)</p></li><li><p>Structured weekly planning</p></li><li><p>Flexible working hours</p></li><li><p>24/7 operational business context</p></li></ul><p>This is not a constant on-call role, but production responsibility is real.<br />Emergency incidents are rare but must be handled professionally.</p><p>We value:</p><ul><li><p>Transparency</p></li><li><p>Ownership</p></li><li><p>Integrity</p></li><li><p>Clear documentation</p></li><li><p>Structured decision-making</p></li></ul><hr /><h1>What You Will Own</h1><ul><li><p>Build production-ready FastAPI services</p></li><li><p>Define migration architecture</p></li><li><p>Improve CI/CD maturity</p></li><li><p>Strengthen infrastructure reliability</p></li><li><p>Design rollback-safe deployments</p></li><li><p>Document architectural decisions</p></li><li><p>Gradually replace the legacy monolith</p></li></ul><p>This is a high-autonomy, high-responsibility role.</p></div></div></blockquote><br/><br/>Please mention the word **FRUITFUL** and tag RNzIuNDkuMjMxLjcx when applying to show you read the job post completely (#RNzIuNDkuMjMxLjcx). This is a beta feature to avoid spam applicants. Companies can search these words to find applicants that read this and see they're human.",2026-03-09T10:34:28+00:00,https://remoteOK.com/remote-jobs/remote-senior-python-backend-engineer-mission-critical-amstar-curacao-1130690,"dev, python, FastAPI, sql, linux, Pytest, Nginx, apache, javascript, react, VS Code, Remote Working, GitHub Actions",remoteok
remoteok_1130687,Frontend Engineer II Core Product,Pulley,Remote,,remote,,"<p><strong>冒聼職聜About Pulley</strong></p>
<p>Pulley's mission is to make it easier for anyone to start a company. We believe that more startups should exist and that founder-led companies are more successful in the long term. With Pulley's cap table management tools, companies can better understand and optimize their equity for the long term. Starting a company is hard enough. Managing equity shouldn't be.&nbsp;</p>
<p>We're a high-performing team on a mission to redefine how early-stage leaders build and manage their companies in an AI-native world. As AI reshapes how businesses operate, we see a unique opportunity to reimagine equity and business management from the ground up. A brand-new, unsolved challenge that we're excited to tackle.</p>
<p>Pulley is growing quickly with over 8,000 customers, including startups like Linear, Runway, Fathom, and Roam. Our trajectory is fueled by top investors like Founders Fund, Stripe, General Catalyst, Caffeinated Capital, 8vc, Elad Gil, and other incredible angels. All of our growth has been organic, and we're expanding the team to meet the growing demand.</p>
<p>We're looking for passionate, execution-focused self-starters to help us build the next generation of tools for founders.</p>
<p><strong>冒聼聦聼 About the role</strong></p>
<p>We're looking for a Software Engineer to join our growing team of product-minded engineers. This role sits at the heart of how we build intuitive, powerful tools for startup founders. Tools that help them manage their equity, understand their business, and make critical decisions faster. You'll work closely with designers, PMs, and fellow engineers to bring polished, performant experiences to life.</p>
<p>At Pulley, our frontend engineers don't just build UI, they influence product direction, own the end-to-end experience, and help shape the future of startup tooling in an AI-native world. You'll get to work on high-impact features that are both foundational to our platform and visible to thousands of founders scaling the next generation of companies.</p>
<p>While we're looking for a frontend-focused engineer, we value building skills across the stack, ensuring that you'll have exposure to a myriad of technologies and ample opportunities to learn and grow.&nbsp;</p>
<p><strong>冒聼聸聽 What You'll Do</strong></p>
<ul>
<li>Build and own rich, interactive product features across our web platform, from concept to deployment</li>
<li>Partner closely with design and product to shape user experiences with empathy and craft</li>
<li>Collaborate with backend and AI engineers to deliver seaml<br/><br/>Please mention the word **FLOURISHING** and tag RNzIuNDkuMjMxLjcx when applying to show you read the job post completely (#RNzIuNDkuMjMxLjcx). This is a beta feature to avoid spam applicants. Companies can search these words to find applicants that read this and see they're human.",2026-03-09T09:00:04+00:00,https://remoteOK.com/remote-jobs/remote-frontend-engineer-ii-core-product-pulley-1130687,"frontend, design, software, growth, web, management, engineer, backend, digital nomad",remoteok
remoteok_1130686,Security Engineer,Exodus Movement Inc.,,,remote,,"As a Security Engineer at Exodus, you will play a critical role in strengthening the security and resilience of our platform by engineering scalable defensive systems across enterprise and production environments, with detection and response as core capabilities. This role goes beyond traditional monitoring, you will design and implement scalable automation that empowers our Cyber Defense team to detect, triage, and respond to threats more effectively. By leveraging both AI-assisted and traditional solutions, you will drive measurable improvements to our security operations, enhance incident response readiness, and build systems that scale alongside our growing business. Your work will directly contribute to protecting our users and enabling Exodus to operate securely in an evolving threat landscape.

What You Will Do
芒聙垄 Build smart, AI-assisted automation that reduces manual security work.
芒聙垄 Connect and enrich security data across enterprise and security tools.
芒聙垄 Help improve how quickly and confidently alerts are understood and prioritized.
芒聙垄 Play an active role in security hardening, investigations and incident response.
芒聙垄 Create scalable automation that makes the Cyber Defense team more effective.
芒聙垄 Continuously reduce attack surface across our enterprise and production environments.

Who You Are
芒聙垄 You live in the EMEA Region (UTC 0 to UTC +4 time zones).
芒聙垄 You bring 4+ years of experience in Security Engineering, Detection Engineering, and/or Incident Response.
芒聙垄 You have hands-on experience building AI-driven security automation or agentic workflows.
芒聙垄 You understand AI security concepts and have experience integrating AI/LLM-based tooling into security workflows.
芒聙垄 You're proficient in scripting languages for automation and API integrations.
芒聙垄 You have experience building and improving SecDevOps automations.
芒聙垄 You're comfortable working with SIEMs (queries, alert tuning).
芒聙垄 You're familiar with EDR platforms.<br/><br/>Please mention the word **LOVABLE** and tag RNzIuNDkuMjMxLjcx when applying to show you read the job post completely (#RNzIuNDkuMjMxLjcx). This is a beta feature to avoid spam applicants. Companies can search these words to find applicants that read this and see they're human.",2026-03-09T08:00:05+00:00,https://remoteOK.com/remote-jobs/remote-security-engineer-exodus-movement-inc-1130686,"security, design, api, engineer, engineering, digital nomad",remoteok
remoteok_1130685,Training & Assessment Assessor,Hunt St,,,remote,,"<p></p><p>Job Role: 			Assessor &amp; Assessment Team Admin Support</p><p>Compensation range: 	 $1800 - $2200 AUD / Monthly</p><p>Engagement type:		Independent Contractor Agreement</p><p>Work Schedule: 	This role is expected to align with the AU business hours (approx. 9 AM - 5 PM, Monday to Friday) for collaboration, but as a contractor, you芒聙聶ll have flexibility in how you manage your time.</p><p></p><p>Who We Are: At Hunt St, we help Australian companies hire top remote talent in the Philippines. For this role, you will be engaged directly by the client as an independent contractor. We are not an outsourcing agency. All of our roles are 100% remote so you'll be able to work from home.</p><p>Who The Client Is: A global professional body advancing the field of sports nutrition through education, regulation, and high standards of practice. Operating across multiple regions, it sets rigorous standards for professionals, provides accredited education and certifications, and ensures practitioners are properly trained and insured. An advisory board of leading researchers and practitioners continually updates content and standards based on the latest evidence and compliance requirements.</p><p>Role Overview: We are seeking a Qualified Assessor based in the Philippines to support an Australian Graduate Students芒聙聶 Program.</p><p>The primary responsibility of this role is to assess and mark academic assignments in line with Australian compliance standards. After approximately six months, the role may expand to include marking practical assessments.</p><p>This position requires a strong understanding of competency-based assessment and strict adherence to compliance requirements.</p><p></p><p>Key Responsibilities:脗聽</p><ul><li>Assess and mark academic assignments using structured rubrics and guidelines</li><li>Provide clear, constructive, and compliant feedback to students</li><li>Ensure assessments align with Australian standards and regulatory requirements</li><li>Maintain accurate documentation and assessment records</li><li>Collaborate with the program team to ensure consistency and quality assurance</li></ul><p></p><p></p><p></p><p></p>
<p></p><ul><li>Certificate IV in Training and Assessment (TAE40122 / TAE40116 or equivalent) 芒聙聯 Mandatory for compliance</li><li>Open to candidates with TESDA Trainer/Assessor Certification (will be considered)</li><li>Proven experience conducting competency-based assessments</li><li>Hands-on experience using LMS (Learning Management Systems)</li><li>Hands-on experience using SMS (Student Management Systems)</li><li>Strong written English skills with the ability to provide detailed academic feedback</li><li>High level of accuracy, integrity, and attention to detail</li><li>Ability to work independently in a remote setup<br /></li></ul>Preferred (Nice to Have)<ul><li>Experience working with an Australian organization or RTO</li><li>Familiarity with Australian education compliance standards</li><li>Experience with e-skilled platforms</li><li>Experience with Moodle-based platforms</li><li>Basic familiarity with nutrition concepts (no formal degree required)</li><li>Background in academic marking or training delivery</li></ul><p></p>
<p></p><p>Work Arrangement &amp; Expectations:</p><p>This is a remote role that will be set up as an independent contractor engagement.</p><p>To ensure alignment and transparency, successful candidates will be expected to:</p><p></p><ul><li>Disclose any existing ongoing roles or client work</li><li>Reflect this engagement on their LinkedIn profile (clearly marked as 芒聙聹Independent Contractor芒聙聺)</li></ul><br/><br/>Please mention the word **ARDENTLY** and tag RNzIuNDkuMjMxLjcx when applying to show you read the job post completely (#RNzIuNDkuMjMxLjcx). This is a beta feature to avoid spam applicants. Companies can search these words to find applicants that read this and see they're human.",2026-03-09T08:00:03+00:00,https://remoteOK.com/remote-jobs/remote-training-assessment-assessor-hunt-st-1130685,"training, support, education, admin, management, content, non tech",remoteok
remoteok_1130684,Product Operations Lead,Alpaca,Remote - Americas,,remote,,"<p><strong>Who We Are:</strong></p>
<p>Alpaca is a US-headquartered self-clearing broker-dealer and brokerage infrastructure for stocks, ETFs, options, crypto, fixed income, 24/5 trading, and more. Our&nbsp;<a href=""https://alpaca.markets/blog/alpaca-raises-150-million-at-a-1-15b-valuation-to-build-the-global-standard-for-brokerage-infrastructure/"">recent Series D funding round</a> brought our total investment to over $320 million, fueling our ambitious vision.</p>
<p>Amongst our subsidiaries, Alpaca is a licensed financial services company, serving hundreds of financial institutions across 40 countries with our institutional-grade APIs. This includes broker-dealers, investment advisors, wealth managers, hedge funds, and crypto exchanges, totalling over 9 million brokerage accounts.</p>
<p>Our global team is a diverse group of experienced engineers, traders, and brokerage professionals who are working to achieve our mission of&nbsp;<strong>opening financial services to everyone on the planet</strong>. We're deeply committed to open-source contributions and fostering a vibrant community, continuously enhancing our award-winning, developer-friendly API and the robust infrastructure behind it.</p>
<p>Alpaca is proudly backed by top-tier global investors, including Portage Ventures, Spark Capital, Tribe Capital, Social Leverage, Horizons Ventures, Unbound, SBI Group, Derayah Financial, Elefund, and Y Combinator.</p>
<p>&nbsp;</p>
<p><strong>Our Team Members:</strong></p>
<p>We're a dynamic team of 230+ globally distributed members who thrive working from our favorite places around the world, with teammates spanning the USA, Canada, Japan, Hungary, Nigeria, Brazil, the UK, and beyond!<br><br>We're searching for passionate individuals eager to contribute to Alpaca's rapid growth. If you align with our core values芒聙聰Stay Curious, Have Empathy, and Be Accountable芒聙聰and are ready to make a significant impact, we encourage you to apply.</p></div><div><p>&nbsp;</p>
<p>&nbsp;</p>
<p><strong>Your Role</strong>:</p>
<p>Fix Alpaca's operational bottlenecks for scale.&nbsp;</p>
<p>Your mission is to own and break the cycle of operational debt by transforming high-risk bottlenecks into automated, scalable solutions. You will operate as the critical bridge, ensuring Alpaca's ambitions are balanced against operational reality to secure the foundation for parabolic growth.&nbsp;</p>
<p><strong>Things You Get To Do:</strong></p>
<ul>
<li><strong>Own Structural Bottlenecks: </strong>Own the product roadmap for Alpaca's internal workflows and tooling.<strong> </strong>Drive root cause analysis and execute on the most complex and high-risk operational problems (e.g. AML/KYC workflows, reconciliations, corporate actions, cost basis processing, tax reporting, and security master/reference data management)</li>
<li><strong>Automation Strategy:</strong> Design systems and leverage internal tooling, AI, and workflow orchestration, so existing operations teams can support 100x growth. Eliminate critical failure modes by automating core workflows.&nbsp;</li>
<li><strong>Delivery &amp; Measurement:</strong> Define clear success metrics and SLAs. Write crisp specifications, map processes, and work cross-functionally to sh<br/><br/>Please mention the word **THOUGHTFUL** and tag RNzIuNDkuMjMxLjcx when applying to show you read the job post completely (#RNzIuNDkuMjMxLjcx). This is a beta feature to avoid spam applicants. Companies can search these words to find applicants that read this and see they're human.",2026-03-09T07:00:07+00:00,https://remoteOK.com/remote-jobs/remote-product-operations-lead-alpaca-1130684,"design, crypto, security, support, financial, investment, api, lead, operations, operational, digital nomad",remoteok
